{
	"$schema": "./templates/schemas/config.json",
	"variants":
	{
		"build":
		{
			"description": "The build type.",
			"options": [
				"release",
				"debug"
			]
		}
	},
	"destinations":
	{
		"bin": { "root": "bin" },
		"tmp":
		{
			"root": "tmp",
			"folders":
			{
				"target": {},
				"platform": {},
				"build": {}
			}
		}
	},
	"extensions":
	{
		"obj": [
		{
			"filters": [{ "platform": "winapi" }],
			"value": ".obj"
		}],
		"exe": [
		{
			"filters": [{ "platform": "winapi" }],
			"value": ".exe"
		}]
	},
	"products":
	{
		"tester": [
		{
			"filters": [{ "target": "unit" }],
			"base": "tester",
			"separator": "_",
			"prefix": {},
			"suffix": {}
		}]
	}
}
